### ISSUE TITLE
FastRouter sends requests to suwsgi (ssl-socket|suwsgi-socket) backends in plaintext

### ISSUE THREAD

**Issue by pierrrrrr** [unbit/uwsgi#1423]
I am experiencing an issue with a connection between FastRouter and **suwsgi** backend node.

The connection gets closed by the backend node and an empty response is returned to the client (_curl_ connecting to HTTP proxy in front of FastRouter).

```
curl localhost:8000
curl: (52) Empty reply from server
```
FastRouter logs following error:

```
[uwsgi-fastrouter key: localhost:8000 client_addr: 127.0.0.1 client_port: 36531] fr_instance_read(): Connection reset by peer [plugins/fastrouter/fastrouter.c line 212]
```

It appears that FastRouter is sending data in plaintext instead of SSL (see _tcpdump_ output below).

After reading [documentation](http://uwsgi-docs.readthedocs.io/en/latest/Fastrouter.html) I assumed FastRouter supports connections to **suwsgi** nodes - was I mistaken or this is a bug?

## Setup

High-level overview of the configuration:

```
                     load balancer                            backend node
           +----------------------------------+             +--------------+
           |                                  |             |              |
--(HTTPS)----> Nginx --(uwsgi_pass)--> uWSGI -----(suwsgi)-----> uWSGI     |
           |                             ^-----(subscription)-------       |
           |                                  |             |              |
           +----------------------------------+             +--------------+
```

Please note, in the configuration snippets below I have replaced Nginx with uWSGI HTTP router for better portability.

When I switch to plaintext **uwsgi** protocol (_--socket_) on the backend node, above setup behaves as expected.

## Versions

- CentOS 6 _x86_64_
- Python 2.7 (installed from [IUS](https://ius.io/))
- uWSGI 2.0.14 (installed with pip2.7 [9.0.1]) and 2.1-dev-2dc8fdd

### HTTP proxy

```
[uwsgi]
master = 1
http = :8000
http-to = localhost:9000
```

### FastRouter

```
[uwsgi]
master = 1
fastrouter = :9000
fastrouter-subscription-server = :9999
```

### Backend node

```
[uwsgi]
master = 1
wsgi-file = pong.py
ssl-socket = localhost:10000,localhost.crt,localhost.key
subscribe2 = server=localhost:9999,key=localhost:8000,proto=suwsgi
```

### HTTP proxy
```
*** Starting uWSGI 2.1-dev-2dc8fdd (64bit) on [Sat Dec 10 11:55:46 2016] ***
compiled with version: 4.4.7 20120313 (Red Hat 4.4.7-17) on 08 December 2016 20:51:40
os: Linux-2.6.32-642.1.1.el6.x86_64 #1 SMP Tue May 31 21:57:07 UTC 2016
nodename: uwsgi.vbox.local
machine: x86_64
clock source: unix
pcre jit disabled
detected number of CPU cores: 1
current working directory: /vagrant/bug
detected binary path: /usr/local/uwsgi-head/bin/uwsgi
your processes number limit is 1024
your memory page size is 4096 bytes
detected max file descriptor number: 65535
lock engine: pthread robust mutexes
thunder lock: disabled (you can enable it with --thunder-lock)
uWSGI http bound on :8000 fd 3
Python version: 2.7.12 (default, Jun 28 2016, 17:49:40)  [GCC 4.4.7 20120313 (Red Hat 4.4.7-17)]
*** Python threads support is disabled. You can enable it with --enable-threads ***
Python main interpreter initialized at 0x26be8f0
your mercy for graceful operations on workers is 60 seconds
your request buffer size is 4096 bytes
*** Operational MODE: no-workers ***
spawned uWSGI master process (pid: 17096)
spawned uWSGI http 1 (pid: 17099)
*** http stats server enabled on :8001 fd: 9 ***
```

### FastRouter
```
*** Starting uWSGI 2.1-dev-2dc8fdd (64bit) on [Sat Dec 10 11:55:46 2016] ***
compiled with version: 4.4.7 20120313 (Red Hat 4.4.7-17) on 08 December 2016 20:51:40
os: Linux-2.6.32-642.1.1.el6.x86_64 #1 SMP Tue May 31 21:57:07 UTC 2016
nodename: uwsgi.vbox.local
machine: x86_64
clock source: unix
pcre jit disabled
detected number of CPU cores: 1
current working directory: /vagrant/bug
detected binary path: /usr/local/uwsgi-head/bin/uwsgi
your processes number limit is 1024
your memory page size is 4096 bytes
detected max file descriptor number: 65535
lock engine: pthread robust mutexes
thunder lock: disabled (you can enable it with --thunder-lock)
uWSGI fastrouter bound on :9000 fd 3
uWSGI fastrouter subscription server bound on :9999 fd 4
Python version: 2.7.12 (default, Jun 28 2016, 17:49:40)  [GCC 4.4.7 20120313 (Red Hat 4.4.7-17)]
*** Python threads support is disabled. You can enable it with --enable-threads ***
Python main interpreter initialized at 0x26e79b0
your mercy for graceful operations on workers is 60 seconds
your request buffer size is 4096 bytes
*** Operational MODE: no-workers ***
spawned uWSGI master process (pid: 17095)
spawned uWSGI fastrouter 1 (pid: 17098)
*** fastrouter stats server enabled on :9001 fd: 10 ***
[uwsgi-subscription for pid 17098] new pool: localhost:8000 (hash key: 2630, algo: wrr)
[uwsgi-subscription for pid 17098] localhost:8000 => new node: :10000 (weight: 1, backup: 0)
[uwsgi-fastrouter key: localhost:8000 client_addr: 127.0.0.1 client_port: 40627] fr_instance_read(): Connection reset by peer [plugins/fastrouter/fastrouter.c line 212]
```

### Backend node (suwsgi)
```
*** Starting uWSGI 2.1-dev-2dc8fdd (64bit) on [Sat Dec 10 11:55:46 2016] ***
compiled with version: 4.4.7 20120313 (Red Hat 4.4.7-17) on 08 December 2016 20:51:40
os: Linux-2.6.32-642.1.1.el6.x86_64 #1 SMP Tue May 31 21:57:07 UTC 2016
nodename: uwsgi.vbox.local
machine: x86_64
clock source: unix
pcre jit disabled
detected number of CPU cores: 1
current working directory: /vagrant/bug
detected binary path: /usr/local/uwsgi-head/bin/uwsgi
your processes number limit is 1024
your memory page size is 4096 bytes
detected max file descriptor number: 65535
lock engine: pthread robust mutexes
thunder lock: disabled (you can enable it with --thunder-lock)
uwsgi socket 0 bound to TCP address :10000 fd 3
Python version: 2.7.12 (default, Jun 28 2016, 17:49:40)  [GCC 4.4.7 20120313 (Red Hat 4.4.7-17)]
*** Python threads support is disabled. You can enable it with --enable-threads ***
Python main interpreter initialized at 0x1867e70
your server socket listen backlog is limited to 100 connections
your mercy for graceful operations on workers is 60 seconds
your request buffer size is 4096 bytes
mapped 145632 bytes (142 KB) for 1 cores
*** Operational MODE: single process ***
WSGI app 0 (mountpoint='') ready in 0 seconds on interpreter 0x1867e70 pid: 17097 (default app)
*** uWSGI is running in multiple interpreter mode ***
spawned uWSGI master process (pid: 17097)
spawned uWSGI worker 1 (pid: 17100, cores: 1)
*** Stats server enabled on :10001 fd: 10 ***
subscribing to server=127.0.0.1:9999,key=localhost:8000,proto=suwsgi
```

### tcpdump suwsgi port

Below output has been cut to include _FastRouter  > backend node_ conversation only - [whole conversation ](https://gist.github.com/pierrrrrr/539b9b97ac0b556ac045b4890ffbb6ff)is available on Gist.

```
...
11:37:08.318825 IP 127.0.0.1.49420 > 127.0.0.1.10000: Flags [S], seq 1286959319, win 65495, options [mss 65495,sackOK,TS val 178815660 ecr 0,nop,wscale 5], length 0
	0x0000:  0000 0304 0006 0000 0000 0000 0000 0800  ................
	0x0010:  4500 003c f27b 4000 4006 4a3e 7f00 0001  E..<.{@.@.J>....
	0x0020:  7f00 0001 c10c 2710 4cb5 70d7 0000 0000  ......'.L.p.....
	0x0030:  a002 ffd7 1d06 0000 0204 ffd7 0402 080a  ................
	0x0040:  0aa8 82ac 0000 0000 0103 0305            ............
11:37:08.318832 IP 127.0.0.1.10000 > 127.0.0.1.49420: Flags [S.], seq 1437264876, ack 1286959320, win 65483, options [mss 65495,sackOK,TS val 178815660 ecr 178815660,nop,wscale 5], length 0
	0x0000:  0000 0304 0006 0000 0000 0000 0000 0800  ................
	0x0010:  4500 003c 0000 4000 4006 3cba 7f00 0001  E..<..@.@.<.....
	0x0020:  7f00 0001 2710 c10c 55aa ebec 4cb5 70d8  ....'...U...L.p.
	0x0030:  a012 ffcb 4e15 0000 0204 ffd7 0402 080a  ....N...........
	0x0040:  0aa8 82ac 0aa8 82ac 0103 0305            ............
11:37:08.318836 IP 127.0.0.1.49420 > 127.0.0.1.10000: Flags [.], ack 1, win 2047, options [nop,nop,TS val 178815660 ecr 178815660], length 0
	0x0000:  0000 0304 0006 0000 0000 0000 0000 0800  ................
	0x0010:  4500 0034 f27c 4000 4006 4a45 7f00 0001  E..4.|@.@.JE....
	0x0020:  7f00 0001 c10c 2710 4cb5 70d8 55aa ebed  ......'.L.p.U...
	0x0030:  8010 07ff 6ed0 0000 0101 080a 0aa8 82ac  ....n...........
	0x0040:  0aa8 82ac                                ....
11:37:08.318847 IP 127.0.0.1.49420 > 127.0.0.1.10000: Flags [P.], seq 1:400, ack 1, win 2047, options [nop,nop,TS val 178815660 ecr 178815660], length 399
	0x0000:  0000 0304 0006 0000 0000 0000 0000 0800  ................
	0x0010:  4500 01c3 f27d 4000 4006 48b5 7f00 0001  E....}@.@.H.....
	0x0020:  7f00 0001 c10c 2710 4cb5 70d8 55aa ebed  ......'.L.p.U...
	0x0030:  8018 07ff ffb7 0000 0101 080a 0aa8 82ac  ................
	0x0040:  0aa8 82ac 008b 0100 0e00 5245 5155 4553  ..........REQUES
	0x0050:  545f 4d45 5448 4f44 0300 4745 540b 0052  T_METHOD..GET..R
	0x0060:  4551 5545 5354 5f55 5249 0100 2f09 0050  EQUEST_URI../..P
	0x0070:  4154 485f 494e 464f 0100 2f0c 0051 5545  ATH_INFO../..QUE
	0x0080:  5259 5f53 5452 494e 4700 000f 0053 4552  RY_STRING....SER
	0x0090:  5645 525f 5052 4f54 4f43 4f4c 0800 4854  VER_PROTOCOL..HT
	0x00a0:  5450 2f31 2e31 0b00 5343 5249 5054 5f4e  TP/1.1..SCRIPT_N
	0x00b0:  414d 4500 000b 0053 4552 5645 525f 4e41  AME....SERVER_NA
	0x00c0:  4d45 1000 7577 7367 692e 7662 6f78 2e6c  ME..uwsgi.vbox.l
	0x00d0:  6f63 616c 0b00 5345 5256 4552 5f50 4f52  ocal..SERVER_POR
	0x00e0:  5404 0038 3030 300c 0055 5753 4749 5f52  T..8000..UWSGI_R
	0x00f0:  4f55 5445 5204 0068 7474 700b 0052 454d  OUTER..http..REM
	0x0100:  4f54 455f 4144 4452 0900 3132 372e 302e  OTE_ADDR..127.0.
	0x0110:  302e 310b 0052 454d 4f54 455f 504f 5254  0.1..REMOTE_PORT
	0x0120:  0500 3338 3537 390f 0048 5454 505f 5553  ..38579..HTTP_US
	0x0130:  4552 5f41 4745 4e54 6c00 6375 726c 2f37  ER_AGENTl.curl/7
	0x0140:  2e31 392e 3720 2878 3836 5f36 342d 7265  .19.7.(x86_64-re
	0x0150:  6468 6174 2d6c 696e 7578 2d67 6e75 2920  dhat-linux-gnu).
	0x0160:  6c69 6263 7572 6c2f 372e 3139 2e37 204e  libcurl/7.19.7.N
	0x0170:  5353 2f33 2e32 3120 4261 7369 6320 4543  SS/3.21.Basic.EC
	0x0180:  4320 7a6c 6962 2f31 2e32 2e33 206c 6962  C.zlib/1.2.3.lib
	0x0190:  6964 6e2f 312e 3138 206c 6962 7373 6832  idn/1.18.libssh2
	0x01a0:  2f31 2e34 2e32 0900 4854 5450 5f48 4f53  /1.4.2..HTTP_HOS
	0x01b0:  540e 006c 6f63 616c 686f 7374 3a38 3030  T..localhost:800
	0x01c0:  300b 0048 5454 505f 4143 4345 5054 0300  0..HTTP_ACCEPT..
	0x01d0:  2a2f 2a                                  */*
11:37:08.318851 IP 127.0.0.1.10000 > 127.0.0.1.49420: Flags [.], ack 400, win 2080, options [nop,nop,TS val 178815660 ecr 178815660], length 0
	0x0000:  0000 0304 0006 0000 0000 0000 0000 0800  ................
	0x0010:  4500 0034 6941 4000 4006 d380 7f00 0001  E..4iA@.@.......
	0x0020:  7f00 0001 2710 c10c 55aa ebed 4cb5 7267  ....'...U...L.rg
	0x0030:  8010 0820 6d20 0000 0101 080a 0aa8 82ac  ....m...........
	0x0040:  0aa8 82ac                                ....
11:37:08.318905 IP 127.0.0.1.10000 > 127.0.0.1.49420: Flags [R.], seq 1, ack 400, win 2080, options [nop,nop,TS val 178815660 ecr 178815660], length 0
	0x0000:  0000 0304 0006 0000 0000 0000 0000 0800  ................
	0x0010:  4500 0034 6942 4000 4006 d37f 7f00 0001  E..4iB@.@.......
	0x0020:  7f00 0001 2710 c10c 55aa ebed 4cb5 7267  ....'...U...L.rg
	0x0030:  8014 0820 6d1c 0000 0101 080a 0aa8 82ac  ....m...........
	0x0040:  0aa8 82ac
...
```

### HTTP proxy stats
```
{
    "active_sessions": 0,
    "cheap": 0,
    "cwd": "/vagrant/bug",
    "gid": 500,
    "http": [
        ":8000"
    ],
    "pid": 17099,
    "static_nodes": [
        {
            "grace": 0,
            "hits": 1,
            "name": "127.0.0.1:9000"
        }
    ],
    "uid": 500,
    "version": "2.1-dev-2dc8fdd"
}
```

### FastRouter stats
```
{
    "active_sessions": 0,
    "cheap": 0,
    "cwd": "/vagrant/bug",
    "fastrouter": [
        ":9000",
        ":9999"
    ],
    "gid": 500,
    "pid": 17098,
    "subscriptions": [
        {
            "algo": "wrr",
            "hash": 2630,
            "hits": 1,
            "key": "localhost:8000",
            "nodes": [
                {
                    "backup": 0,
                    "cores": 1,
                    "death_mark": 0,
                    "failcnt": 0,
                    "gid": 0,
                    "last_check": 1481371267,
                    "last_requests": 0,
                    "load": 0,
                    "modifier1": 0,
                    "modifier2": 0,
                    "name": ":10000",
                    "pid": 0,
                    "proto": "s",
                    "ref": 0,
                    "requests": 1,
                    "rx": 399,
                    "tx": 0,
                    "uid": 0,
                    "vassal": "",
                    "weight": 1,
                    "wrr": 0
                }
            ],
            "sni_enabled": 0
        }
    ],
    "uid": 500,
    "version": "2.1-dev-2dc8fdd"
}
```

### Backend node stats
```
{
    "cwd": "/vagrant/bug",
    "gid": 500,
    "listen_queue": 0,
    "listen_queue_errors": 0,
    "load": 0,
    "locks": [
        {
            "user 0": 0
        },
        {
            "signal": 0
        },
        {
            "filemon": 0
        },
        {
            "timer": 0
        },
        {
            "rbtimer": 0
        },
        {
            "cron": 0
        },
        {
            "rpc": 0
        },
        {
            "snmp": 0
        }
    ],
    "pid": 17097,
    "signal_queue": 0,
    "sockets": [
        {
            "can_offload": 0,
            "max_queue": 100,
            "name": ":10000",
            "proto": "suwsgi",
            "queue": 0,
            "shared": 0
        }
    ],
    "uid": 500,
    "version": "2.1-dev-2dc8fdd",
    "workers": [
        {
            "accepting": 1,
            "apps": [
                {
                    "chdir": "",
                    "exceptions": 0,
                    "id": 0,
                    "modifier1": 0,
                    "mountpoint": "",
                    "requests": 0,
                    "startup_time": 0
                }
            ],
            "avg_rt": 0,
            "cores": [
                {
                    "id": 0,
                    "in_request": 0,
                    "offloaded_requests": 0,
                    "read_errors": 0,
                    "req_info": {},
                    "requests": 0,
                    "routed_requests": 0,
                    "static_requests": 0,
                    "vars": [],
                    "write_errors": 0
                }
            ],
            "delta_requests": 0,
            "exceptions": 0,
            "harakiri_count": 0,
            "id": 1,
            "last_spawn": 1481370946,
            "pid": 17100,
            "requests": 0,
            "respawn_count": 1,
            "rss": 0,
            "running_time": 0,
            "signal_queue": 0,
            "signals": 0,
            "status": "idle",
            "tx": 0,
            "vsz": 0
        }
    ]
}
````

**Comment by unbit** [comment]
Hi, albeit all the pieces are in (in 2.1 subscription packets can ask for specific protocols), there is currently no support for encrypting traffic between the fastrouter and backends

**Comment by pierrrrrr** [comment]
Hi

Thank you for clarification. Are there any timelines for having `suwsgi` backend support in the FastRouter?

**Comment by unbit** [comment]
Hi @pierrrrrr it is not in the TODO list, but if you want you can drop a mail to info at unbit.it and ask for/propose a quotation.

**Comment by pierrrrrr** [comment]
Hello!

Does HTTP router support HTTPS backend?

I would love to see `suwsgi` backend support in FastRouter - unfortunately I have no budget available. I would be happy to help with my spare time, if you decided to implement it.

Is there any good workaround to add encryption to router-backend communication (`stunnel` maybe)?

**Comment by unbit** [comment]
Hi @pierrrrrr there is no ssl client support in uWSGI, that is why it is not an easy task. Regarding stunnel, if you can tolerate the overhead, i think it is absolutely a viable approach:

fastrouter -> stunnel -> uwsgi

obviously the uwsgi instance must subscribe with the address of stunnel (you need an stunnel process per instance):

```py
[uwsgi]
; spawn a stunnel managed by the master
attach-daemon = stunnel ...stunnel_address uwsgi_address
; subscribe with the addess of stunnel
subscribe2 = server=fastrouter_server,key=domain_name,addr=stunnel_address

; bind to uwsgi socket
socket = uwsgi_address

```

**Comment by pierrrrrr** [comment]
Hello @unbit 

> fastrouter -> stunnel -> uwsgi

Yes, this is precisely what I had in mind - although I have not used `stunnel` before so it's a bit of a guesswork for me.

Shouldn't there be two `stunnel` processes?
One on backend node (server mode - to wrap `uwsgi` socket in SSL) and other one on the FastRouter node (client mode - to allow router to connect to SSL-wrapped backend).

The backend node setup would be quite simple: `attach-daemon` and `subscribe2+addr` options would work really together.

Unfortunately I can not think of equivalent FastRouter configuration to allow it to create `stunnel` connection to SSL-wrapped backend socket upon node subscription - any suggestions?

**Comment by unbit** [comment]
The uwsgi socket is already capable of ssl so you only need an stunnel from the fastrouter to the uwsgi socket

**Comment by pierrrrrr** [comment]
> The uwsgi socket is already capable of ssl so you only need an stunnel from the fastrouter to the uwsgi socket

Of course, silly me!

So to summarise FastRouter configuration would be:
```ini
[uwsgi]
; Pre-create stunnel to allow FastRouter to connect to backend node when it subscribes
attach-daemon = stunnel ...STUNNEL_ADDRESS UWSGI_ADDRESS
fastrouter = :9000
fastrouter-subscription-server = :9999
```

and backend node:
```ini
[uwsgi]
ssl-socket = UWSGI_ADDRESS
; Use stunnel address as configured on the FastRouter
subscribe2 = server=fastrouter_server,key=domain_name,addr=STUNNEL_ADDRESS
```
