### ISSUE TITLE
uwsgi crash: lxc, open vpn client from nested lxc container, fastrouter

### ISSUE THREAD

**Issue by ovanes** [unbit/uwsgi#749]
```
$ lsb_release
Distributor ID: Ubuntu
Description:    Ubuntu 14.04.1 LTS
Release:    14.04
Codename:   trusty
```

```
$ uname -a
Linux my_lxc_vm 3.13.0-37-generic #64-Ubuntu SMP Mon Sep 22 21:28:38 UTC 2014 x86_64 x86_64 x86_64 GNU/Linux
```

Tested with:
- uWSGI version 2.0.6-debian
- uWSGI version 2.0.7 from pip

I have a setup with LXC containers where I need to use fastrouter plugin to access a uwsgi-load balancer. uwsgi vassals are within nested LXC containers and are all setup with ubuntu 14.04.1.

OpenVPN is up and working. I can ping containers in both sides everything works fine. I also receive pings and occasional heartbits from the openvpn client. OpenVPN client runs in the nested LXC container (ubuntu trusty).

Here is the tcpdump output from the server running openvpn server:

```
$ sudo tcpdump -i eth0 -n udp
tcpdump: verbose output suppressed, use -v or -vv for full protocol decode
listening on eth0, link-type EN10MB (Ethernet), capture size 65535 bytes
17:32:21.350664 IP 10.0.3.181.1194 > 10.0.3.235.1194: UDP, length 53
17:32:21.351097 IP 10.0.3.235.1194 > 10.0.3.181.1194: UDP, length 53
17:32:26.606822 IP 10.0.3.235.1194 > 10.0.3.181.1194: UDP, length 125
17:32:26.607458 IP 10.0.3.181.1194 > 10.0.3.235.1194: UDP, length 125
17:32:27.608345 IP 10.0.3.235.1194 > 10.0.3.181.1194: UDP, length 125
17:32:27.608707 IP 10.0.3.181.1194 > 10.0.3.235.1194: UDP, length 125
17:32:28.609609 IP 10.0.3.235.1194 > 10.0.3.181.1194: UDP, length 125
17:32:28.609923 IP 10.0.3.181.1194 > 10.0.3.235.1194: UDP, length 125
17:32:29.609086 IP 10.0.3.235.1194 > 10.0.3.181.1194: UDP, length 125
17:32:29.609394 IP 10.0.3.181.1194 > 10.0.3.235.1194: UDP, length 125
```

Server runs fastrouter uwsgi config:

```
[uwsgi]
plugins = fastrouter,logfile
master = true
shared-socket = 127.0.0.1:3031
fastrouter-subscription-server = 0.0.0.0:2626
fastrouter = =0
fastrouter-cheap = true
vacuum = true
req-logger=file:/tmp/access_uwsgi.log
logger     = file:/tmp/error_uwsgi.log
```

client config:

```
[uwsgi]
master = true
processes = 2
threads = 4
heartbeat = 10
socket = 10.0.*:0
subscribe2 = server=10.0.3.181:2626,key=10.0.3.181

#socket = 10.5.*:0
#subscribe2 = server=10.5.0.1:2626,key=10.0.3.181

module=myapp
callable=app
virtualenv=env2

vacuum = true
harakiri = 10
max-requests = 100
logformat = %(addr) - %(user) [%(ltime)] "%(method) %(uri) %(proto)" %(status) %(size) "%(referer)" "%(uagent)"
```

Starting uwsgi without openvpn client being enabled tcpdump traces subscribe packets from the client:

```
tcpdump: verbose output suppressed, use -v or -vv for full protocol decode
listening on eth0, link-type EN10MB (Ethernet), capture size 65535 bytes
17:42:44.706355 IP 10.0.3.235.46465 > 10.0.3.181.2626: UDP, length 106
17:42:45.709349 IP 10.0.3.235.56805 > 10.0.3.181.2626: UDP, length 106
```

Enabling openvpn client:

```
$ sudo openvpn --remote 10.0.3.181 --comp-lzo --dev tun --ca ca.crt --client --proto udp --cert uwsgi_fastrouter_client.crt --key uwsgi_fastrouter_client.key --tls-auth ta.key 1 --verb 3
```

makes uwsgi to produce a segfault:

```
$ uwsgi --ini config.ini
[uWSGI] getting INI configuration from config.ini
!!! uWSGI process 2454 got Segmentation Fault !!!
*** backtrace of 2454 ***
uwsgi(uwsgi_backtrace+0x2e) [0x461ece]
uwsgi(uwsgi_segfault+0x21) [0x462291]
/lib/x86_64-linux-gnu/libc.so.6(+0x36c30) [0x7f7d5f48dc30]
/lib/x86_64-linux-gnu/libc.so.6(inet_ntop+0x288) [0x7f7d5f571218]
uwsgi(generate_socket_name+0xee) [0x42171e]
uwsgi(uwsgi_opt_add_socket+0x11) [0x45fd61]
uwsgi(uwsgi_manage_opt+0x28) [0x443d78]
uwsgi(uwsgi_configure+0x49) [0x443dd9]
uwsgi(uwsgi_setup+0x405) [0x464885]
uwsgi(main+0x9) [0x416909]
/lib/x86_64-linux-gnu/libc.so.6(__libc_start_main+0xf5) [0x7f7d5f478ec5]
uwsgi() [0x416937]
*** end of backtrace ***
```

What I see from the backtrace that `generate_socket_name` produces a segfault. I turned off the `socket = 10.0.*:0` notation to the real IP: 10.0.4.204 (nested lxc ip) and no more crashes.

Using the fixed IP notation seems to properly route uwsgi requests. Disabling openvpn makes the notation `socket = 10.0.*:0` work fine.
